fingerprint,title,author,hostname,date,categories,tags,id,license,comments,source,source-hostname,excerpt,filename,has_text
2aEVSJuUJW4o5XW1Bkr6aMraaq0=,The Cat’s Daughters,Nitoo Das,uncannymagazine.com,2018-01-02,,,,,,https://www.uncannymagazine.com/article/the-cats-daughters/,Uncanny Magazine,"Prologue We grew inside our mother. She whispered to us, “You are mine, mine.” Not knowing better, we agreed. Beside her skin’s luminous husk, we were foam-feelings, limbs creased like clouds, permeable blobs. We stayed on hold slowly expanding, surging slippery like similes. (i) We imagined our mother’s unhurried beauty: dark and large with a […]",./scrape/jsonfiles/ldTYsytVBhZvlBA0skowDtuw+N4.json,True
CqilOAEUYKVrr5dRqFgeK8E2T7g=,The Span of His Wrist,Lee Mandelo,uncannymagazine.com,2020-12-01,,,,,,https://www.uncannymagazine.com/article/the-span-of-his-wrist/,Uncanny Magazine,"From behind the desk-cum-checkout counter, Lucy said, “I’m sure you’ll find some good pieces. The family was super eager to clear the estate or I wouldn’t have been able to snatch the whole lot, and I’ll give you a deal, because obviously I overshot.” Hangers scraped on metal as Katrin sifted through the items on […]",./scrape/jsonfiles/7-Rpe2QopLCMDH4rYHyerDqGE8E.json,True
RoHBU1KBq+8jyk1NVp0yzT4wd8w=,lagahoo culture (Part II),Brandon O’Brien,uncannymagazine.com,2021-03-02,,,,,,https://www.uncannymagazine.com/article/lagahoo-culture-part-ii/,Uncanny Magazine,"you open the papers, wipe the headline-stains on the back of your knee, grumble that the world has changed since you were young. elder, all it did was become high definition. it turned your window into a pathway, and you don’t like standing in its light. there are so many trees you don’t […]",./scrape/jsonfiles/SXIDtFd4l+yEfDGJFf7Ohr8KZa0.json,True
9TOL9VEef7/u8SQqHNtt9XAgndo=,Kamanti’s Child,Jennifer Marie Brissett,uncannymagazine.com,2016-11-01,,,,,,https://www.uncannymagazine.com/article/kamantis-child/,Uncanny Magazine,"Kamanti mindspoke to her swollen belly, Sekke Sekke. Then cooed and hummed. The precious gift given to women to hear the voice of their unborn child had thus far eluded her. Kamanti’s aunt had said the baby was very stubborn, and would only speak when it thought it had something worthy of saying. And so […]",./scrape/jsonfiles/5dxJKAVScphhNcWIy7LruYpPzXc.json,True
k1N5XXbIsR5Q0azcracsp+N55IU=,Metal Like Blood in the Dark,T Kingfisher,uncannymagazine.com,2020-09-01,,,,,,https://www.uncannymagazine.com/article/metal-like-blood-in-the-dark/,Uncanny Magazine,"Once upon a time there was a man who built two enormous machines, and he loved them very much. He called them Brother and Sister and programmed them with intelligences that woke and stretched and tested the limits of their metal bodies. When they did not like those limits, they altered them, nanite scurrying over […]",./scrape/jsonfiles/cqZpIzfklZ5URDHQx+UpyLWj2+E.json,True
6dBvq2/h7FCIfIEyrU9uuAX9lnU=,The Night Dance,Leah Cypess,uncannymagazine.com,2022-01-04,,,,,,https://www.uncannymagazine.com/article/the-night-dance/,Uncanny Magazine,"They told us we were princesses, and we believed them. At least, I believed them. I think most of the others did, too. Except Kenna, perhaps; she had her suspicions. But Kenna was suspicious of everything, always. It made her tiring to talk to. To be fair, we did live in a castle. And we […]",./scrape/jsonfiles/jyAEoOV6jtd-J3XH3VZ9QO4R7GA.json,True
NvTm8fm1Dq46u0/I1GYNBgQTTyM=,I Frequently Hear Music in the Very Heart of Noise,Sarah Pinsker,uncannymagazine.com,2018-03-06,,,,,,https://www.uncannymagazine.com/article/frequently-hear-music-heart-noise/,Uncanny Magazine,"“This green-gold city will embrace you/ Take you out of time and erase you/ And for one brief moment you will let her/ For one night only you’ll be hers” —Bess Morris, “For One Night Only,” 1924 The Ambassador Billiard Parlor, the Aeolian Hall, Our Metropolitan Madness Just before midnight on January 3, 1924, Ira […]",./scrape/jsonfiles/hZljLTqAL2+SF0FFpjWA9TlOUDQ.json,True
aJd5YxwRqaq/PLG5HIjs3yH7c7A=,Deep Bitch,C S E Cooney,uncannymagazine.com,2015-03-03,,,,,,https://www.uncannymagazine.com/article/deep-bitch/,Uncanny Magazine,Deep Bitch by C.S.E. Cooney,./scrape/jsonfiles/oV7gUUTtnyLaLJFtLCv9+riCkCs.json,True
mZ5pSJIPwo+EwsEAIX6jT4QQVTY=,After the Moon Princess Leaves,Isabel Yap,uncannymagazine.com,2015-01-06,,,,,,https://www.uncannymagazine.com/article/moon-princess-leaves/,Uncanny Magazine,After the Moon Princess Leaves by Isabel Yap. Uncanny Magazine Issue Two. Poem.,./scrape/jsonfiles/Aj1YtWtvABpGRQh-uUnhmFYQR8w.json,True
gkiIp5g8QASC7pCGGOvTCPIrvEw=,Black Flowers Blossom,Vina Jie-Min Prasad,uncannymagazine.com,2019-12-03,,,,,,https://www.uncannymagazine.com/article/black-flowers-blossom/,Uncanny Magazine,"I was in the parlour of 427 Cheyne Walk, listening to the occult detective relate his story. I had knowledge of the events of the White Studio—the letter from the artist’s son about his father’s death, the reports of a mysterious pearl-white glow from the studio, and, of course, what happened after—but I wished to […]",./scrape/jsonfiles/Jg9v+SELTvwKGRfUfMD+NZttSGk.json,True
583Vg9bTPcWHfOux+J+vdL/mLmQ=,The Worshipful Society of Glovers,Mary Robinette Kowal,uncannymagazine.com,2017-08-01,,,,,,https://www.uncannymagazine.com/article/worshipful-society-glovers/,Uncanny Magazine,"Outside the cracked window of the garret, the cockle-seller hollered, “Cockles an’ mussels! Cockles an’ mussels!” Her voice blended with the other London morning street sounds to mean that Vaughn was going to be late. “Botheration.” He tied off the thread in the fine blue leather of the gloves he was stitching and snipped it […]",./scrape/jsonfiles/DVw2l58s7ciExqlJ6ejcGcwLLZI.json,True
ZYsy8cZtGKZnlrVrO6hHuzeWyDc=,What They Love Now,Sara Cleto; Brittany Warman,uncannymagazine.com,2023-04-04,,,,,,https://www.uncannymagazine.com/article/what-they-love-now/,Uncanny Magazine,"The souls in my garden sing: At noon, when light cracks through Sea-salt to the sandy beds And again, when midnight Spreads the sky with stars in A radiance that we, Deep-water dwellers, Can only feel Under our skin, scales. They sing of what they Once loved: Princes, their […]",./scrape/jsonfiles/7feNcHmBcJruzEP5Q4QQEUsE8As.json,True
hNEw1jDBomRIJNoaGCgvHetWkgk=,A Hundred and Seventy Storms,Aliette de Bodard,uncannymagazine.com,2016-07-05,,,,,,https://www.uncannymagazine.com/article/hundred-seventy-storms/,Uncanny Magazine,"This is the room where The Snow Like a Dancer dies, year by year and piece by piece. When they wheel in the cradle where she rests, she always thinks—for a bare, suspended moment—that it will be all right, that it will all end well—and then nausea tightens around her, and the white and stark […]",./scrape/jsonfiles/SsvgqhT2jZaivccStNFRfN0Cmf8.json,True
fom8m+6NcLVsJPvjKv0Vm2Iyvmc=,The Stop After the Last Station,A T Greenblatt,uncannymagazine.com,2021-11-02,,,,,,https://www.uncannymagazine.com/article/the-stop-after-the-last-station/,Uncanny Magazine,"Tito never believed that the stop after the last subway station existed, the place where the world supposedly changed for the better. The one he needs six silver tokens to get to. Until he does. Until he needs to. That’s when he boards the subway and travels on it for two and a half years, […]",./scrape/jsonfiles/3mlR54x5s5VEcILSW2z3SLVUUYo.json,True
6ME/5VkvhHhiQoq4eWhxpJZSF9o=,"Wendy, Waiting",Sandi Leibowitz,uncannymagazine.com,2019-04-02,,,,,,https://www.uncannymagazine.com/article/wendy-waiting/,Uncanny Magazine,"Not easy, spending my life in this one house, my nights at this window. Not easy, those first ten years saying no, turning down dances, husbands, till eventually I said yes to avoid the innuendos, and take up what might be termed my life. It’s not Peter I pine for, though he’s why I wait, […]",./scrape/jsonfiles/sQmbZoVM03gHz58EbrhaFxbRYb0.json,True
pSDdtHPCNwPUyfAmTmkbMBZ5N1M=,The Saga of Captain Jens,C S E Cooney,uncannymagazine.com,2015-07-07,,,,,,https://www.uncannymagazine.com/article/the-saga-of-captain-jens/,Uncanny Magazine,"""The Saga of Captain Jens"" a poem by C.S.E. Cooney in Uncanny Magazine Issue Five.",./scrape/jsonfiles/2Dz4IUPeVJ+2XNzHNZcCFDXYaV4.json,True
iVQlLDWCBdGSAXTuVBqr0W05M/k=,Lorelei,Ali Trotta,uncannymagazine.com,2018-05-01,,,,,,https://www.uncannymagazine.com/article/lorelei/,Uncanny Magazine,"Mother used to say if you sing the right note, time turns backward, an unraveling of mistakes, a new gasp of breath, a second chance, depths like a shipwreck, full of old magick. Back then, we sang desire bare to its bones, sharp in the moonlight, our songs relentless, reckless, and justified— all love is […]",./scrape/jsonfiles/3jeUkwqTKv75aakIKdAed7zjCsc.json,True
tbmSCvAzy7ACRREjxt4tDOgHW/k=,Rose Child,Theodora Goss,uncannymagazine.com,2016-11-01,,,,,,https://www.uncannymagazine.com/article/rose-child/,Uncanny Magazine,"Wandering among the roses in my garden, I found a child, only five inches tall, under a Madam Hardy. She was standing on mulch, leaning against one of the rose canes. I bent down to look at her, and she looked back fearlessly. She was lean and brown, dressed in a dormouse skin, cleverly sewn […]",./scrape/jsonfiles/OW2NkltFfTHelZGdmWBpPH76-dQ.json,True
1ooxaGuFjtvagrp8IclfZx620HM=,Biting Tongues,Amal El–Mohtar,uncannymagazine.com,2015-10-06,,,,,,https://www.uncannymagazine.com/article/biting-tongues/,Uncanny Magazine,Biting Tongues by Amal El-Mohtar. Uncanny Magazine Issue Six poetry,./scrape/jsonfiles/zfhoCo5kQG-TZXmI8NyBPqldZmI.json,True
ST5cVqyjFqtU/1i5PiG55jrWvcI=,"To Hunger, As with Perfect Faith",Radha Kai Zan,uncannymagazine.com,2022-08-02,,,,,,https://www.uncannymagazine.com/article/to-hunger-as-with-perfect-faith/,Uncanny Magazine,"Content note: sexual violence, abuse, ableism Every morning I clear the virgins from the stairway. It is common that one or two offerings don’t make it through the cold of the mountain eve or fall asleep in death midway through the journey up to our distant frigid peak. Their relatives or escorts leave them […]",./scrape/jsonfiles/sgS+BweuE7DFIDsTOeCn7mTr8PY.json,True
dhPhr/Bw2377eJ/QSvcw+ChGyHE=,As One Listens to the Rain,Andrea Chapela; Emma Törzs,uncannymagazine.com,2022-10-04,,,,,,https://www.uncannymagazine.com/article/as-one-listens-to-the-rain/,Uncanny Magazine,They say the City was once the largest in the world. They say its buildings stretched across the valley and crept up the hills and peaks until every inch of land was covered in concrete from mountain range to mountain range. They say the sky was always grey and at night you couldn’t see the […],./scrape/jsonfiles/Y54g2objBLlnvWRY0IrTvyLrcaE.json,True
bU9UKwn1ywMHwA/Hlu7UnfEyRPE=,Every Song Must End,Bonnie Jo Stufflebeam,uncannymagazine.com,2019-03-05,,,,,,https://www.uncannymagazine.com/article/every-song-must-end/,Uncanny Magazine,"Currently listening: “Everything” by Ben Howard When Florence and her husband Asher had first moved into their house, Asher hung a hummingbird feeder from the roof overhang. Now Florence listened to the buzz of hummingbird wings as they sucked red from plastic white petals as false as the picture of calm in Florence’s backyard: Florence […]",./scrape/jsonfiles/2EErm-LgS3UzjuOZARSgGGrMNYE.json,True
aZQVbBpJ9threl/Ksm6uj9psnKM=,The Mausoleum's Children,Aliette de Bodard,uncannymagazine.com,2023-05-02,,,,,,https://www.uncannymagazine.com/article/the-mausoleums-children/,Uncanny Magazine,"Thuận Lộc stared at the cup. It was dark, and mottled with the characteristic patterning of silver-eye fungus. The tea inside was trembling—the faint vibrations from the Mausoleum, the dead ships’ atrophied motors that would never again allow them to hang, weightless, among the stars. Even now—even standing far away from it in that small […]",./scrape/jsonfiles/MRImIebnCTT4wzm-oGcYVqrmd-E.json,True
Cy/qAnLXEX3jYBj9iqzITBjYo94=,Other Forms of Conjuring the Moon,Chloe N Clark,uncannymagazine.com,2019-04-02,,,,,,https://www.uncannymagazine.com/article/other-forms-of-conjuring-the-moon/,Uncanny Magazine,"I never liked the trick with the girl and the swords. The magician would lead her to the box; she’d peek inside, as if expecting it to lead somewhere unusual, a book-filled desert or an ice cream shop only serving root beer floats, right before entering. The door would shut and I’d always think she […]",./scrape/jsonfiles/QQxYitiJibF+3GRn0db9gh8ocfM.json,True
q5x7dWhUMBF0CKsDzEVxNfuOedA=,Find a Way Home,Paul Cornell,uncannymagazine.com,2015-09-01,,,,,,https://www.uncannymagazine.com/article/find-a-way-home/,Uncanny Magazine,Find a Way Home by Paul Cornell Issue Six short fiction.,./scrape/jsonfiles/igp+pEh9cRAlYNT+JhOy+NIK60g.json,True
QMv3Q7WC9lXQQKM6WuJp4naoeFQ=,Hungry Ghost,Millie Ho,uncannymagazine.com,2020-03-03,,,,,,https://www.uncannymagazine.com/article/hungry-ghost/,Uncanny Magazine,"My girlfriend became a hungry ghost on the 4th of August, twig-necked with skin as wet as gasoline, needlepoint mouth unable to keep down anything. We met on a language exchange app, me the English teacher who’d swooped into Hongdae like a sudden wind, her the ulzzang who dreamed of opening a BBQ restaurant […]",./scrape/jsonfiles/5Qa3OPws9fXvQLs8bqNzvlC28Zw.json,True
eWlAi6gVs3uSCvUY+lGqKfMFgUw=,Steeped in Stars,Hal Y Zhang,uncannymagazine.com,2019-02-05,,,,,,https://www.uncannymagazine.com/article/steeped-in-stars/,Uncanny Magazine,"Jasmine, night blossom, vetiver to my barren heart, let me caress you. don’t go. Your sweet song perched on my ear rings steps into round gates between bamboo groves, a gaggle of cousins underfoot. Grandparents chorus greetings inside while layering symphonic poems of perfume and tannin in handwoven baskets. In the fingerless swelter I fold […]",./scrape/jsonfiles/ZaakP7eL5GVmvPsFdv9j3EOlteE.json,True
F1NRAJKuK97USsXRvK94DkVrgzA=,A Call to Arms for Deceased Authors' Rights,Karin Tidbeck,uncannymagazine.com,2015-12-01,,,,,,https://www.uncannymagazine.com/article/a-call-to-arms-for-deceased-authors-rights/,Uncanny Magazine,"I Prelude An author dies. Then the newly discovered texts surface. They’re drafts, notes, sometimes entire manuscripts. They appear in the clutter on a desk, or in the publisher’s computer, or among newspapers and dead spiders in a summer cottage chest. Sometimes they spill forth as if from a horn of plenty (see: Tolkien). Sometimes […]",./scrape/jsonfiles/KI4bQg01fb+ZOkc3hUfFhiKVx1M.json,True
kkt+bVEHnX7LZyDMbYCPwTromRI=,The Artificial Bees,Simon Guerrier,uncannymagazine.com,2016-04-05,,,,,,https://www.uncannymagazine.com/article/the-artificial-bees/,Uncanny Magazine,"Randall lowered one foot on to the surface of green fibers. The organic matter yielded under her weight but seemed to support her. She dared to put a second foot on to the strange, graminoid material—just as Archive came back with a response. “A lawn,” it told her. “Proceed with operation.” Randall prowled across the […]",./scrape/jsonfiles/XamdHGl+Co4vaR5CkdrgZ9PKAr0.json,True
ORNBqTM+3DEkLR8y3x0K35Cj854=,Our Talons Can Crush Galaxies,Brooke Bolander,uncannymagazine.com,2016-11-01,,,,,,https://www.uncannymagazine.com/article/talons-can-crush-galaxies/,Uncanny Magazine,"This is not the story of how he killed me, thank fuck. You want that kind of horseshit, you don’t have to look far; half of modern human media revolves around it, lovingly detailed descriptions of sobbing women violated, victimized, left for the loam to cradle. Rippers, rapists, stalkers, serial killers. Real or imagined, their […]",./scrape/jsonfiles/zZFQsmszRfwN2nfKifkt2uU5TSc.json,True
owkpS5e4JNCcAQ7XxNACQYEwwmw=,Transference,Vivian Shaw,uncannymagazine.com,2022-11-01,,,,,,https://www.uncannymagazine.com/article/transference/,Uncanny Magazine,"It’s working. With every buzzing, burning line Rae traces on my back—the needle feels like a red-hot knifepoint drawn across the skin—it’s working. I was terrified when we began, not of the pain but of the uncertainty: would this do anything at all, would there be any difference whatsoever in the dream I’ve been trapped […]",./scrape/jsonfiles/g9KOMXG90uoJrDd56ZLm6lkiazI.json,True
bmBLkzyyMJ6/RsiabjZ1HpMV9z0=,Questions We Asked for the Girls Turned to Limbs,Chloe N Clark,uncannymagazine.com,2017-08-01,,,,,,https://www.uncannymagazine.com/article/questions-asked-girls-turned-limbs/,Uncanny Magazine,"Do you remember the hands of men? How they pressed into your skin until red blossomed across the surface? How their intentions left patterns on your body? When you fled through fields, through forests, up mountains, up hills, into streams, into […]",./scrape/jsonfiles/Fr-vYFTmQNoQ4qki4RAO6wwrS10.json,True
j5xYxaoIm0WhBMzEO/ieHP6PNFE=,Ctenophore Soul,Rita Chen,uncannymagazine.com,2018-09-04,,,,,,https://www.uncannymagazine.com/article/ctenophore-soul/,Uncanny Magazine,"A soul is birthed sealed shut. Trembling, fragile membrane cocoons the glistening fluid, clear and rich with possibles: ichor mixed with tears. Gentle, now; surface tension. Clutch your shimmering, sea-jelly soul that caught sunlight in its depths somewhere. If it still remains unbroken, make a tear— just enough for the soul-stuff to trickle out into […]",./scrape/jsonfiles/d+yHk3PSu00Nn-61rs8IZW3F1l8.json,True
xluXSjhajY8W7Fgjbrb0aKqJh58=,can i offer you a nice egg in this trying time,Iori Kusano,uncannymagazine.com,2022-12-06,,,,,,https://www.uncannymagazine.com/article/can-i-offer-you-a-nice-egg-in-this-trying-time/,Uncanny Magazine,"Matt tells the waiter he’ll have his eggs over easy. They come back scrambled, a neat glistening pile framed by perfect triangles of toast, a lacy froth of hashbrowns lurking across the plate. He doesn’t notice he’s chosen to move until he’s already halfway to the kitchen, adrenaline flooding his body. It feels good, electric, […]",./scrape/jsonfiles/cbwvm0Z8Lwh5mgfnvX5-sQ3fRPg.json,True
5YaXlJz3apHwZVxG3lSq2raIqmw=,Jingwei Tries to Fill Up the Sea,Mary Soon Lee,uncannymagazine.com,2022-04-05,,,,,,https://www.uncannymagazine.com/article/jingwei-tries-to-fill-up-the-sea/,Uncanny Magazine,"Mountain pebble gripped in her beak, Jingwei flies over forest and field mile after mile after mile, she flies over rice farmers, over foresters over river fishermen who spot her shadow flying below them across a shadow sky over mouse and rat, hare and shrew, their thousand small and busy lives […]",./scrape/jsonfiles/dP6StFbZFFYdJ0vv0vNfdb6l4gM.json,True
e15Ih3CKZebCjl+v2nNQU2RD7sM=,"You Can Make a Dinosaur, but You Can’t Help Me",K M Szpara,uncannymagazine.com,2018-07-03,,,,,,https://www.uncannymagazine.com/article/you-can-make-a-dinosaur-but-you-cant-help-me/,Uncanny Magazine,"Your boyfriend is lying on the bed, flushed, with his shirt unbuttoned and his skirt pushed up over his thighs when he asks, “Do you want to pick, tonight?” The question knocks you off balance like a strong wind blowing so quickly by, you can’t breathe—and, for a moment, you can’t. Deep yearning lingers in […]",./scrape/jsonfiles/KxwyJ0KBHBnQ3fxlDMPx0gvYsEw.json,True
0UltHx/NoSsabXP82WLsz/3Ir4c=,The Ruby of the Summer King,Mari Ness,uncannymagazine.com,2020-08-04,,,,,,https://www.uncannymagazine.com/article/the-ruby-of-the-summer-king/,Uncanny Magazine,"The Summer King fell in love with the Winter Queen before they even met. He dwelt in the heart of summer in bursts of fruit and green, a place the denizens of winter did not and could not even consider approaching. But even in summer, tales were told of her stark beauty, of her penchant […]",./scrape/jsonfiles/Jj+Bxdb8aCCJ-u3beMmxESiD0fw.json,True
iDyK2E5P5lg1uKqkP75PbdKA8Nk=,"Temperance and The Devil, Reversed",Ali Trotta,uncannymagazine.com,2023-02-07,,,,,,https://www.uncannymagazine.com/article/temperance-and-the-devil-reversed/,Uncanny Magazine,"It begins with running, always the same bone-white panic— running from something bigger than yourself, this story told and retold, until it shapeshifts into something Other, and it chases you like a wolf. Unkindness arrives in a whirl of black songs, a triumph made of feathers unfurling like frost across glass, delicate and beautiful, disarming, […]",./scrape/jsonfiles/n1bEegDrEEpPK7DndNBfPks1G5Q.json,True
az2aC/1L5PiZZN8iRqaZqZ5Y9Co=,To Whomsoever Remains,Brandon O’Brien,uncannymagazine.com,2023-02-07,,,,,,https://www.uncannymagazine.com/article/to-whomsoever-remains/,Uncanny Magazine,"as I write this I am catching up on the news and the news was about nothing at all, the usual flames rising up from the cracks of everything we know, nothing special, but randomly I noticed in the B-roll there was this little slice of a clip of a soldier walking past a bakery […]",./scrape/jsonfiles/rIzE9tpYWi6B6Dh+JO3Drap7PcE.json,True
MNayeCx0ZbcOHiSJ1uQad/SSW2E=,Spice Islands,Nin Harris,uncannymagazine.com,2017-11-07,,,,,,https://www.uncannymagazine.com/article/spice-islands/,Uncanny Magazine,For my Grandmother and Derek Walcott Voyages by sea from two spice islands lay claim to the hidden song that is plucked by momentum from my hidden sinews. There is no logic or reason to this intersection of personal histories. Why two men with diverging histories sailed from Jaffna and became station masters. Why their […],./scrape/jsonfiles/NmFloaN1eHrIF6YueibbfLVpHoA.json,True
wh7dS877izrEEoHPumqxKyH9PGM=,The Desert Glassmaker and the Jeweler of Berevyar,R B Lemberg,uncannymagazine.com,2016-02-02,,,,,,https://www.uncannymagazine.com/article/the-desert-glassmaker-and-the-jeweler-of-berevyar/,Uncanny Magazine,"Dearest Maru of house unknown, I have purchased, these five days ago, a small piece of your glasswork. It fits snugly in my hand, a drop–shaped vial of flame. Desert glass, said the traders, shaped from the desert sand by your fiery magic. It speaks to me. No, more than speaks—it sings—of dawns in saturated […]",./scrape/jsonfiles/qDkBz8-G6tTqD-I81UJsm9w9NjY.json,True
OFejcWM2cB6436jMWySoss8oW60=,Probabilitea,John Chu,uncannymagazine.com,2019-05-07,,,,,,https://www.uncannymagazine.com/article/probabilitea/,Uncanny Magazine,"Ordinary fathers lead ordinary lives. They go to work, they raise the kid, they open their homes for the weekly mahjong and meal that rotates from one family to the next in their circle of Chinese immigrants. When they text their daughters, the cell phone vibrates discreetly. If the phone is buried in a backpack, […]",./scrape/jsonfiles/OEGSNXDJ7-KoFWJvowoj3Mvgq6o.json,True
iiZHkHv4RYY4jD5QcZDxZMnsuGE=,The Father Provincial of Mare Imbrium,E Lily Yu,uncannymagazine.com,2023-02-07,,,,,,https://www.uncannymagazine.com/article/the-father-provincial-of-mare-imbrium/,Uncanny Magazine,"Out of an abundance of caution, and as a condition of its funding and founding, the Jesuit lunar colony established in the southwest corner of Mare Imbrium was subject to Curial censorship, with violators placed under interdict. That did not stop the occasional enterprising regent from smuggling out, by shuttle and courier, the green silicon […]",./scrape/jsonfiles/TZdimUjCR-cA1VbSVKdO2WmlQuU.json,True
G9XrCPj+Q43b0aRVMYWFjA3bfRk=,The Hole Thing,Neil Gaiman,uncannymagazine.com,2023-01-03,,,,,,https://www.uncannymagazine.com/article/the-hole-thing/,Uncanny Magazine,"Now, let us gather to imagine the future. Here, in the Central Hall of Arts and Sciences as it was, before Victoria laid the first stone. Here, where the dead were annually raised, implored, exhorted, ectoplasmically embraced, Here, where Hiawatha musically wed, and Os-Ke-Non-Ton sang the medicine man, to Samuel Coleridge-Taylor’s once-loved score, Here where […]",./scrape/jsonfiles/HcefeKExTh9F4mWlg+hjaQnRtpg.json,True
7GsJqj3hD6oFcUR+t7yA5QtAqoE=,The Howling Detective,Brandon O’Brien,uncannymagazine.com,2018-04-03,,,,,,https://www.uncannymagazine.com/article/the-howling-detective/,Uncanny Magazine,"At his desk, Ken idled with a Polaroid picture and muttered a few confused curses. He had been staring at it for hours, finding something obvious and dismissing it as far too strange, refusing to appreciate it. “What’s that you lookin’ at there?” a coworker said over his shoulder. Ken turned it over and slid […]",./scrape/jsonfiles/jJM734wpOlpwBuGM6EdLBkLLGPI.json,True
IFuYJ20kx/qbAT2u48R05GoF8MI=,"Children of Thorns, Children of Water",Aliette de Bodard,uncannymagazine.com,2017-07-04,,,,,,https://www.uncannymagazine.com/article/children-thorns-children-water/,Uncanny Magazine,"With thanks to Stephanie Burgis, Fran Wilde and Kate Elliott It was a large, magnificent room with intricate patterns of ivy branches on the tiles, and a large mirror above a marble fireplace, the mantlepiece crammed with curios from delicate silver bowls to Chinese blue-and-white porcelain figures: a clear statement of casual power, to leave […]",./scrape/jsonfiles/5OB5ch3pTMBsvCPxNNbe5E+3cMM.json,True
yfXEg1UPtgX59QCO8lS5rtMLmvc=,Mona Lisa’s Abecedarian to Leonardo da Vinci,Abu Bakr Sadiq,uncannymagazine.com,2021-06-01,,,,,,https://www.uncannymagazine.com/article/mona-lisas-abecedarian-to-leonardo-da-vinci/,Uncanny Magazine,"all they’ve said about the painting is a lie‚ except my being a sphinx of beauty. to think they’d ever call me a vampire feels unbelievable‚ until you remember that I’ve been dead more times than I’ve been alive. the truth remains, my eyelashes had been plucked and fed to fishes. the untold story goes, […]",./scrape/jsonfiles/SgTq27pjM+r66WLb3q39JN9kB6M.json,True
