fingerprint,title,author,hostname,date,categories,tags,id,license,comments,source,source-hostname,excerpt,filename,has_text
4xunTCyZ2LxaJrBxZiQt75gn6YQ=,"Kannazuki, or the Godless Month",Betsy Aoki,uncannymagazine.com,2023-01-03,,,,,,https://www.uncannymagazine.com/article/kannazuki-or-the-godless-month/,Uncanny Magazine,"The moments turned in an instant; flash of anger in the eyes, sheen of a black gun barrel, safety off, bullets fired and fired and fired. The gods are not with us, they began traveling to Izumo. We all wanted food before we lost everything—sense of touch, taste, smell, the light inside our eyes dimming […]",./scrape/jsonfiles/hK6Dd2guyowWdIE6bj+VoGSk90Q.json,True
sA2+1+96W0XFZ+1ER7RL78sMTjM=,Abigail Dreams of Weather,Stu West,uncannymagazine.com,2018-10-02,,,,,,https://www.uncannymagazine.com/article/abigail-dreams-of-weather/,Uncanny Magazine,"Everything is broken. The screen that takes up one entire wall of the play area is broken, cracked from corner to corner. There’s nothing usable in the games and toys cupboard, which is piled high with neatly stacked boxes full of mismatched parts and flat batteries. The few handhelds that work at all are agonizingly […]",./scrape/jsonfiles/mu9+Gc-5u+1rkcXwX91QVZ7SDaA.json,True
kr18vY/9uXWR4LocfinOZpdhyas=,Compassionate Simulation,Rachel Swirsky; P H Lee,uncannymagazine.com,2019-07-02,,,,,,https://www.uncannymagazine.com/article/compassionate-simulation/,Uncanny Magazine,"(Content Note: Abuse) Static. Startle. Wait. Wait. You’re—wait. You? “—your grandfather always said it was okay to talk to yourself—” Yes. You. You are. You are floating. No, not floating—numb. No, not numb—nothing. You are nothing? No. Wait. “—to yourself as long as you don’t start answering—” Thinking hurts. “—You’d better show up before that […]",./scrape/jsonfiles/x4jiLoZpZtuLVzcw1btsDLkp1fo.json,True
Hh0V/0pBvoFVCAvkN5OSK0FrMNU=,Ye Highlands and Ye Lowlands,Seanan McGuire,uncannymagazine.com,2016-05-03,,,,,,https://www.uncannymagazine.com/article/ye-highlands-ye-lowlands/,Uncanny Magazine,"Ye Highlands and ye Lowlands, Oh, where have you been? They have slain the Earl of Moray, And they laid him on the green. —Child Ballad 181, “The Bonny Earl of Moray.” Things have consequences. Kids figure that out around the time they’re old enough to realize that when they touch a hot stove, they […]",./scrape/jsonfiles/dpcv3wcsMCPaRj8B6uSbq+4InTw.json,True
R5Go4crEbFHtL6P9zHP8yiqPGX8=,Listen,Karin Tidbeck,uncannymagazine.com,2018-10-02,,,,,,https://www.uncannymagazine.com/article/listen/,Uncanny Magazine,"Mika only visited Aino Korhonen ahead of time because he was in an upward swing. He had awoken with a longing to see people, talk to them, to be surrounded by life. All the interesting markets and people were up the spokes, so that’s where he went. Aino’s workshop lay in an artisan quarter on […]",./scrape/jsonfiles/hWZK5uXg+ybW4kOu1t9TsMRf+uU.json,True
Qj4uxH419/CYN2S4SiUNjbtTJk4=,Six Fictions About Unicorns,Rachael K Jones,uncannymagazine.com,2021-10-05,,,,,,https://www.uncannymagazine.com/article/six-fictions-about-unicorns/,Uncanny Magazine,"1. Your unicorn first finds you when you run away from home. You had planned to live forever in the woods. You packed all the necessities: three cans of baked beans, a packet of butter crackers, your insulin, a water bottle, your clarinet, your marching band shirt. You drew yourself a map on the endpaper […]",./scrape/jsonfiles/WvOYR1Ag82m5-2yZu8m9RYwS3BI.json,True
6Cg01KPmRTh4Rz35y1K12t+A0Kw=,Read Before Use,Chinelo Onwualu,uncannymagazine.com,2017-05-02,,,,,,https://www.uncannymagazine.com/article/read-before-use/,Uncanny Magazine,"The basement of Satellite City’s main library was made up of several levels dug deep into the earth. Even this early, several hours before dawn, each level was filled with scholars poring over old documents, students fetching and carrying, and stewards and handmaids scurrying about. Alia flashed her cartouche at the attendant on duty and […]",./scrape/jsonfiles/cFhZiBXtu0VBSJZNBupeuBlKmgM.json,True
4jitkHCc5I25PeNKuItay8DsEak=,“Eating Disorder” does not begin to describe it,R B Lemberg,uncannymagazine.com,2019-10-01,,,,,,https://www.uncannymagazine.com/article/eating-disorder-does-not-begin-to-describe-it/,Uncanny Magazine,"I unzip my body like a big soft sack, | looking for more things to sell—",./scrape/jsonfiles/yBVzxB-hR79St8by0WBryiYUEp4.json,True
52USFKf9llVqAENS5XqHVnzkb1A=,Domovoi,R B Lemberg,uncannymagazine.com,2017-08-01,,,,,,https://www.uncannymagazine.com/article/domovoi/,Uncanny Magazine,"Here I am, the understove-listener, the ancestral keeper of an indefinite gender and infinite hairiness who lives under your kitchen threshold, under your fridge, making your ice cubes perfectly square when you deign to pour yourself a drink: minimalist living requires an absence. I protect you while you sleep—but you want to wake up in […]",./scrape/jsonfiles/p+6ziEqd1HqGUWp51CWA-OaGxPw.json,True
b2iocbSz2H1xm4DXhx+7XdHxTiY=,The Infinite Endings of Elsie Chen,Kylie Lee Baker,uncannymagazine.com,2023-05-02,,,,,,https://www.uncannymagazine.com/article/the-infinite-endings-of-elsie-chen/,Uncanny Magazine,"Content Note: death, car accidents, drug overdose, murder, internalized homophobia, mentions of gun violence I am simply not the kind of person who dies. Even before the Monarch told me the truth, I knew it the way animals know to burrow into the earth before landslides, the way they taste storms on the wind […]",./scrape/jsonfiles/sFUDMv2C2SRMlGVZ8CB-z6jNsQQ.json,True
FiN1PftawLIADiOK/lPUb/gR1AU=,Elemental Love,Rachel Swirsky,uncannymagazine.com,2017-11-07,,,,,,https://www.uncannymagazine.com/article/elemental-love/,Uncanny Magazine,"Fifty-three percent: Water. Tasteless, odorless, almost colorless blue. A single oxygen atom with open arms, clasping hydrogen twins. The universal solvent, creating the specific you. Eighteen-and-a-half percent: Carbon. As graphite, soft enough to mark paper. In diamond, hard enough to withstand the pressure of six million atmospheres. In your body, the respiration of thirty-seven trillion […]",./scrape/jsonfiles/mjK9PHXZzERrjPRxSjygzD2jHco.json,True
TSAUGuKhqHiHpop2HGUt4ZjlGBk=,Wooden Feathers,Ursula Vernon,uncannymagazine.com,2015-11-03,,,,,,https://www.uncannymagazine.com/article/wooden-feathers/,Uncanny Magazine,"The carving was going badly. Sarah examined the duck decoy before her and sighed. The bill was shaped entirely wrong. It was supposed to be a mallard, but she hadn’t taken enough off before she began shaping and now the bill was half again as long as it should be. I’ll flare the bill and […]",./scrape/jsonfiles/GE123sL2olHH6a1X552KzhAUMbM.json,True
ubaozECxrDGL7axNStCv1TK1W0k=,Juvenilia,Lavie Tidhar,uncannymagazine.com,2020-10-06,,,,,,https://www.uncannymagazine.com/article/juvenilia/,Uncanny Magazine,"In the winter of 19–, having newly arrived in England, and still recovering from the nervous indisposition which had afflicted me greatly ever since my circumstances during the war, I responded to an advertisement placed in the Yorkshire Post, for the position of caretaker in an old, near-abandoned Elizabethan mansion called Wildfell Hall. Who in […]",./scrape/jsonfiles/mYSaM8Z7Ksw9s49IwTGgbqwJD+Q.json,True
g30iBYfr/aDm1vqexFilK2aWFxk=,The Ache of Home,Maurice Broaddus,uncannymagazine.com,2017-07-04,,,,,,https://www.uncannymagazine.com/article/the-ache-of-home/,Uncanny Magazine,"The Indy Metro bus came to a shuddering halt and deposited Celeste Burroughs at her stop. A plastic shelter enclosed a bench printed with the words “Embrace Mortality.” Celeste looped the cord of her earbuds around her thumb then unwound it, careful not to pull the cord free from her pocket, where it trailed, not […]",./scrape/jsonfiles/lbi5Wlx-pyE0XPUigRAtjcUMATM.json,True
PKKiuBl/1NVvIOEi00UbnlSwCuQ=,Ghost Champagne,Charlie Jane Anders,uncannymagazine.com,2015-08-04,,,,,,https://www.uncannymagazine.com/article/ghost-champagne/,Uncanny Magazine,"""Ghost Champagne"" by Charlie Jane Anders in Uncanny Magazine Issue Five.",./scrape/jsonfiles/EqBXRtKzseahfrrfc7ZmPb2o8q4.json,True
RuVDZ2Ki4uyXTNW62HG8QOeno3w=,Dustdaughter,Inda Lauryn,uncannymagazine.com,2019-02-05,,,,,,https://www.uncannymagazine.com/article/dustdaughter/,Uncanny Magazine,"“What’s your name, girl?” “Dust.” “Dust! What kinda people named they child Dust!” She sat in thought a moment, recalling what her wayfaring aunt she rarely saw told her to say whenever someone questioned her name, if she could remember it all. “It’s short for Dustdaughter…” “That’s a heavy name for a child.” “My daddy […]",./scrape/jsonfiles/FKopIi9EyGmpecia+I-t9lj3nlA.json,True
e1aR3HOBLDRUQ5USdGbmgihz5VU=,Laws of Impermanence,Kenneth Schneyer,uncannymagazine.com,2020-09-01,,,,,,https://www.uncannymagazine.com/article/laws-of-impermanence/,Uncanny Magazine,"(Content note: domestic violence/murder) It is said that Archimedes was asked by the King of Syracuse to authenticate a manuscript. King Hiero had received what purported to be Alexander of Macedon’s own copy of the Iliad, brought out from the Library at Alexandria itself. He sent envoys to Egypt to ask whether Alexander’s Iliad had […]",./scrape/jsonfiles/DDj5kqJzpa-QMqnpfiaYWFCfutU.json,True
7PzRlXiFZzUU/aTVT9yHQxmTiYU=,For All My Missing Jiejies and Ayis,Sharon Hsu,uncannymagazine.com,2017-11-07,,,,,,https://www.uncannymagazine.com/article/missing-jiejies-ayis/,Uncanny Magazine,"Her face is a dark smudge on a white milk carton. Her face is a pale circle underneath blue ice. Her face is a perfect blank of negative space, because the casting call read white actresses, ages 16-32, only. Her body is only a tangle of limbs in the cavern of a trunk, in the […]",./scrape/jsonfiles/ltsXoefhWap5Nj1zdbIbg2fxtqc.json,True
oUL8l+GIBd9TmaEMkvYnmrZZMvM=,An Abundance of Fish,S Qiouyi Lu,uncannymagazine.com,2017-04-04,,,,,,https://www.uncannymagazine.com/article/an-abundance-of-fish/,Uncanny Magazine,"Spring festival, before the fish arrive: Teresa Teng croons from the radio; I hum along as I hang paper decorations, the reds and golds bright against our cream-colored walls. You’re in the kitchen making dinner—Shanghai-style sauteéd niangao, braised cod, stir-fried green beans. Sizzle, pop. Water runs from the sink, interrupting the music for a moment, […]",./scrape/jsonfiles/31gdspmLplG0zpc4fFZIttFiCrU.json,True
MJIDXu71bnPh6h6RJb+VjU2vGZo=,What Gentle Women Dare,Kelly Robson,uncannymagazine.com,2018-06-05,,,,,,https://www.uncannymagazine.com/article/what-gentle-women-dare/,Uncanny Magazine,"Liverpool, Midsummer, 1763 When Satan himself came to Lolly, she didn’t recognize him. She wasn’t on her guard—hadn’t been for years. Why should she be? Her immortal soul had long since drowned in rum and rotted under gobs of treacle toffee. If any scrap was left, it was too dry and leathery to tempt evil. […]",./scrape/jsonfiles/PVjJ1Unf2P1slFuesxqQ49BQI3g.json,True
3Ex2b4KyMa7Xa8X4PUu79RKtUvE=,A Sharp Breath of Birds,Tina Connolly,uncannymagazine.com,2019-03-05,,,,,,https://www.uncannymagazine.com/article/a-sharp-breath-of-birds/,Uncanny Magazine,"You are two on the day you see your first personal bird. It is the sort of thing you barely remember later, at six, seven, twenty. And yet you cling to it as your first memory: a sleek black penguin waddling through your nursery, it in black, you in white lace, mended and re-mended because […]",./scrape/jsonfiles/kPYFvSSoh8Qo3ATBQEIfU7wsmDg.json,True
rypC6SMn1W/FQUkrMdu+4PLr/VI=,Translatio Corporis,Kat Howard,uncannymagazine.com,2015-03-03,,,,,,https://www.uncannymagazine.com/article/translatio-corporis/,Uncanny Magazine,"Translatio Corporis by Kat Howard, Uncanny Magazine Issue Three",./scrape/jsonfiles/hOL9jVL8tIDVVxuC261MdISuwDg.json,True
gjCDiTnBQgr9NOO025k5gus/IHY=,Seed and Cinder,Jei D Marcade,uncannymagazine.com,2019-09-03,,,,,,https://www.uncannymagazine.com/article/seed-and-cinder/,Uncanny Magazine,"One night on the mountain, you eat his death. You don’t know what compels you to do it. It has been a trying day. Anyone might have committed the same thoughtless act of petty retaliation.",./scrape/jsonfiles/luz09PRlZNYbWflAYRAYCHdmcG4.json,True
Rs9CsPw0SEcv8bG0zkVYkcD/cxQ=,"Earth Dragon, Turning",Anya Ow,uncannymagazine.com,2022-12-06,,,,,,https://www.uncannymagazine.com/article/earth-dragon-turning/,Uncanny Magazine,"Downwind from the encampment, the wind stank of refuse. The stench of people weeks into an unwashed trek intensified as Yue Ling limped out of the tree line, raising her hands over her head as she slowly approached the sentries. Both were young, younger than her oldest nephews. They straightened as she got close, hands […]",./scrape/jsonfiles/1-Ln42c0jaXV75yGIbscLqCCHto.json,True
OSPoz2dHE66pK6fsPrpdH1G16oI=,What Grew,Sarah Gailey,uncannymagazine.com,2018-06-05,,,,,,https://www.uncannymagazine.com/article/what-grew/,Uncanny Magazine,"Before I knew I was pregnant I would stand before the mirror and wonder why I was different why I was growing what was wrong with my too-small skin. “Probably,” (they said, with certainty in their voices, as if they had ever felt anything like what I was feeling) “Probably you do not have a […]",./scrape/jsonfiles/HPdCX9Bn1auYsJXZXIap+6dAzUU.json,True
0EcFcOntExyysWlSUd+b3wGJ8ls=,"Your Slaughterhouse, Your Killing Floor",Sunny Moraine,uncannymagazine.com,2018-02-06,,,,,,https://www.uncannymagazine.com/article/slaughterhouse-killing-floor/,Uncanny Magazine,"This is where the evening splits in half, Henry, love or death. Grab an end, pull hard, and make a wish. —Richard Siken, “Wishbone” A girl walks into a bar. She grabs her forehead and yells “motherFUCK” and the bar and everything around it except for the girl explodes in a blast that vaporizes half […]",./scrape/jsonfiles/OWCLfN2nmPItSYRpJgdxQXr9j5w.json,True
S3lb0j9YYBcxuKSaE2VWOzsHITQ=,Badass Moms in the Zombie Apocalypse,Rae Carson,uncannymagazine.com,2020-01-07,,,,,,https://www.uncannymagazine.com/article/badass-moms-in-the-zombie-apocalypse/,Uncanny Magazine,"My labor pangs are mild at first. They’re intense, sure, but it’s mostly warmth and pressure like my abdomen is hugging itself. I’ve got time. Hours maybe, before I have to flee the enclave and get myself to the birthing hideout. In the meantime, I’m in our makeshift infirmary, trying to get water past old […]",./scrape/jsonfiles/PHihErusjwnasyg4GWRtlqM+9QE.json,True
iACocPvKIJpGJiGUEpjoZ27UViY=,Love Is Never Still,Rachel Swirsky,uncannymagazine.com,2016-03-01,,,,,,https://www.uncannymagazine.com/article/love-is-never-still/,Uncanny Magazine,"The Sculptor Through every moment of carving, I want her as one wants a woman. I want this lithe creature whose limbs I’ve freed from their ivory enclosures, whose rounds and slopes are discovering their shapes beneath my chisel. She is delicately colored like the palest of women, and when I run my fingers across […]",./scrape/jsonfiles/XNtO3qXXB39q8o9Y6iNTDp2VmYw.json,True
n9GzM76wekO2DPJU058A88OD1y8=,The Unknown God,Ann Leckie,uncannymagazine.com,2017-02-07,,,,,,https://www.uncannymagazine.com/article/the-unknown-god/,Uncanny Magazine,"Aworo, Lord of Horses, god of the Western plains, walked into the marketplace in Kalub in the third hour of the morning. It was early summer, and at this hour the sun was warm and comfortable. Pens of livestock and slaves, rickety stalls, rows of fish staring blankly, baskets of fruit, orange and red and […]",./scrape/jsonfiles/2LIY+WEIDlcJCb4MHRhFaP7LnQk.json,True
W3QD1PjdBQ0owpCHyPgTROXH1Jk=,bargain | bin,Ewen Ma,uncannymagazine.com,2021-01-05,,,,,,https://www.uncannymagazine.com/article/bargain-bin/,Uncanny Magazine,"A stranger’s shirt on my back, sweat-sour, I weave a tangled arithmetic through a sea of ink to pawn off dented yellow helm and a pair of blue-stained sleeves for an onigiri. On the polished arcade floor leaning against a shuttered Westwood you are shamefully out of fashion, on the borderlands of expiry, and […]",./scrape/jsonfiles/TJxYFXtb-ovAnCWd2KZjGSLvUAo.json,True
K7SIHy4OFAJxEaAOJICl8YmVVbc=,The Giants of the Violet Sea,Eugenia Triantafyllou,uncannymagazine.com,2021-10-05,,,,,,https://www.uncannymagazine.com/article/the-giants-of-the-violet-sea/,Uncanny Magazine,"I don’t realize how far apart I have grown from my mother until, upon meeting her again, I have to force myself to hug her. When I heard the news, I packed a few things from my personnel apartment at the Omega hospital and booked a ticket on the next train to Tafros. It took […]",./scrape/jsonfiles/R0QXV0WY0SMTHAdyWvWkLxeO8Hc.json,True
DrxaWalqBAgO7rnmAaB4Ayyal4w=,Peridot and Rain,Laura Anne Gilman,uncannymagazine.com,2019-12-03,,,,,,https://www.uncannymagazine.com/article/peridot-and-rain/,Uncanny Magazine,"We never know when the market will come, though it comes twice a year; a stretch of three days, or five, or seven or nine, but never more. Overnight, the sound of wood and nail and turning wheel in the fields that are never plowed, never grazed, where no brambleberries grow, and in the morning […]",./scrape/jsonfiles/Jr4AFN2jeNWeu4Qb6PehbbjDmh4.json,True
PF28mVHEUGMbSCeeuR6kA+p2kTM=,Nice Things,Ellen Klages,uncannymagazine.com,2019-05-07,,,,,,https://www.uncannymagazine.com/article/nice-things/,Uncanny Magazine,"After the memorial service, Phoebe Morris returned to the beachfront townhouse where her mother had lived for the last twenty years, and prepared to cope. There was nothing of Mother’s that she particularly wanted, but there were papers to sort and clothing to donate, and it was her responsibility. She was an only child, an […]",./scrape/jsonfiles/YS51bcDXlw6OUVwIuKm685tSB1I.json,True
ViJ8AytELytW/dWn1D2w3EvoLSo=,A Lovesong From Frankenstein’s Monster,Ali Trotta,uncannymagazine.com,2017-10-03,,,,,,https://www.uncannymagazine.com/article/lovesong-frankensteins-monster/,Uncanny Magazine,"After, it is like surgery: things heal or they don’t, the stitches pull or the wound reopens, offering a spill of fresh grief, a spark of pain, the way steel flints when it is being sharpened— just enough light to be a reminder, but too small to speak against the night. Eventually, you tuck it […]",./scrape/jsonfiles/6RrDfMj2iR+rS59Z0yWbQx5bskg.json,True
4Rbit+4bovH1y018ANEb9C94GSA=,Interlingua,Yoon Ha Lee,uncannymagazine.com,2015-12-01,,,,,,https://www.uncannymagazine.com/article/interlingua/,Uncanny Magazine,"I was monitoring Cherie Peng’s pulse, breathing, her sweaty palms, all of it, when the Sarissa interrupted me. “This proposal of yours,” the Sarissa said. She—the Sarissa insisted on the animate feminine instead of the inanimate sentient pronoun like most of us ships—sent me the document reference so I knew which proposal she was talking […]",./scrape/jsonfiles/BTq1TOlm8U7dxQ9ZTl4U6oWTOy0.json,True
i9PHkzOVQXuVTYS4t7XKWo6hj4w=,The Hurt Pattern,Tochi Onyebuchi,uncannymagazine.com,2022-08-02,,,,,,https://www.uncannymagazine.com/article/the-hurt-pattern/,Uncanny Magazine,"Whenever Nick, over in the workstation across the room, would blurt out “fuck, I got another beheading,” Kenny would pinch the bridge of his nose and sigh and want, more than anything, to say “I don’t care.” Monitors formed a semi-circle in front of Kenny, and his fingers, tips glowing blue with the implants, moved […]",./scrape/jsonfiles/MMwVOdJVc3M0WvtEux-pKlyb-yE.json,True
AgV3V9ff+y6nYtuRpVlOveJfW0s=,In The Wild,Nnadi Samuel,uncannymagazine.com,2023-05-02,,,,,,https://www.uncannymagazine.com/article/in-the-wild/,Uncanny Magazine,"(I) In the Wild A passive brightness scores its initials on the thatched ceiling, as the sun plasticize our shadows on a wall frame. the smeared patches of light, whitewashed for our voice to regift colors. & sound is made flesh. & the luster worms into both language & leash, unsettling—as the raw weave of […]",./scrape/jsonfiles/qqpdLAI3q7iX4Zi8NdGafNo++Oo.json,True
EJj22yoWF0O3zx+IDe40RiPMpVI=,Palingenesia,Simbo; Olumide Manuel,uncannymagazine.com,2022-10-04,,,,,,https://www.uncannymagazine.com/article/palingenesia/,Uncanny Magazine,"the tracks are tumbling in a paunch. a boy left, a quarter devoured in a raw valley. a fading dream done to dust. the mystery charted in susurrations. he looked and we are many here. red trickle trickle stream. i’m losing how to keep this objective. & from the birds, the gasp. from the flames, […]",./scrape/jsonfiles/COcUuQTElkveZmV7lXbz6xLZ9Zo.json,True
U+UCLcPZQ7h/NJklfAxYF2Mb2e0=,Cold Relations,Mary Robinette Kowal,uncannymagazine.com,2023-01-03,,,,,,https://www.uncannymagazine.com/article/cold-relations/,Uncanny Magazine,"Claudette lowered her infrared goggles over her eyes and waited for the ghost. By the cash register, webs of energy, tinted green by the goggles, swirled in a loose spiral. Spectral lines tightened in time with a throbbing hum of energy. As she walked closer, Claudette’s hair stood on end along her neck, and the […]",./scrape/jsonfiles/2WPZL1ey+70HjeefaWT2c+DPVUE.json,True
8UGoSvMR3ISPSgPvuLC2DDCQ05U=,"White Rose, Red Rose",Rachel Swirsky,uncannymagazine.com,2021-12-07,,,,,,https://www.uncannymagazine.com/article/white-rose-red-rose/,Uncanny Magazine,"That morning, there was a white rose on my windowsill, and my heart cracked. I took it inside. I knew well the only things that mattered were that it was a rose and it was white, but I examined it anyway. It had been in full flower recently, but was quickly withering. Several petals were […]",./scrape/jsonfiles/dqAu1Xaue3hzRcEYoKQdhFKwpto.json,True
YwGQ6f7/UARJiKzwGnXrAQHl9XI=,I Built This City For You,Cassandra Khaw,uncannymagazine.com,2017-08-01,,,,,,https://www.uncannymagazine.com/article/i-built-this-city-for-you/,Uncanny Magazine,"Hello. Is this your city? No, no. We understand. It is not a city yet. It is merely embryonic. Conceptual. An idea to which your bones are laced, the sinews that tether the tendons of your dreams. It is only a city in waiting, a city mid-birth, a city breathless, inexorable. But you desire a […]",./scrape/jsonfiles/3YKgqO12s4JbPgxMblnW9WhheBs.json,True
ndYwuQtM22PT0Z1/r4O4jOTdTsY=,I Am a Little Hotel,Ai Jiang,uncannymagazine.com,2022-12-06,,,,,,https://www.uncannymagazine.com/article/i-am-a-little-hotel/,Uncanny Magazine,"and they tell me my body is not the home they’re looking for, not the presidential suite—lavish décor, wine, freshly pressed linen sheets— but sweat-soaked, blood-stained mattress in the basement behind locked doors, covered in dust, abandoned, by everyone but myself. But sometimes, even I forget that beneath withered, wrinkled, time- stamped hands, there once […]",./scrape/jsonfiles/6FLlK3N-WH4pnmTfjGUhsV4gmeA.json,True
avK2ZPEQmSjTutyDxmq25lsmvGk=,The Haunting of Dr. Claudius Winterson,Sarah Monette,uncannymagazine.com,2022-02-01,,,,,,https://www.uncannymagazine.com/article/the-haunting-of-dr-claudius-winterson/,Uncanny Magazine,"That fall, the Parrington Museum’s Henry T. Meadows Scholar was a man named Claudius Winterson, of whom my colleagues had nothing good to say. Dutifully, I attended his public lecture, where I sat well to the back and asked no questions, although several occurred to me. I had not intended—duty or no duty—to go to […]",./scrape/jsonfiles/xl2dUlY2nKesIzBSZucM2IPMQF0.json,True
KG3xHpAifjkPD2diGG2uNlB2Kos=,The Book of Forgetting,Jennifer Crow,uncannymagazine.com,2016-04-05,,,,,,https://www.uncannymagazine.com/article/the-book-of-forgetting/,Uncanny Magazine,"Only love could make me long for all the things I once feared: eternity as silence, forgetfulness, a scar over the raw wound you left behind. You taught me heaven is not a place, but the magic circle drawn around two souls, and then you broke it, invisible ink scuffed so you could let the […]",./scrape/jsonfiles/hBQj8zs3tVG35BYULfJxYi3NoHE.json,True
z92/s9VKb7iGQE5rRsgf/FW6V70=,Neithal from abroad,Shweta Narayan,uncannymagazine.com,2019-09-03,,,,,,https://www.uncannymagazine.com/article/neithal-from-abroad/,Uncanny Magazine,"Even your brine, fish-stink overflowing sky’s nets",./scrape/jsonfiles/8-1gPdSo2xgj1kulG24w9ZoYZhU.json,True
3Uy9BEYAXJDKl31UjBxRuUGj+58=,How the Trick Is Done,A C Wise,uncannymagazine.com,2019-08-06,,,,,,https://www.uncannymagazine.com/article/how-the-trick-is-done/,Uncanny Magazine,"The Magician Takes a Bow How many people can say they were there the night the trick went wrong and the Magician died on stage? Certainly, that first morning on the strip—dazed gamblers blinking in the rising light, the ambulance come and gone, with the smell of gunpowder lingering in the air—everyone claimed they knew […]",./scrape/jsonfiles/6P27Dyw+aN4XKuV39FUaVhbk1oE.json,True
cW5rT0YRFlhARZHcomFSPz2aDAo=,All the Stars Above the Sea,Sarah Gailey,uncannymagazine.com,2018-09-04,,,,,,https://www.uncannymagazine.com/article/all-the-stars-above-the-sea/,Uncanny Magazine,"All the stars are closer now than they have ever been. If you were still beside me you’d reach up on tiptoes, fingers spread to touch the brightest one. But you’re not here, gone deep below for far too long to ever let me think you’re coming back. If you could open up your eyes […]",./scrape/jsonfiles/MWbKSrv4wA9S1DTbG13GbmhR6nE.json,True
