fingerprint,title,author,hostname,date,categories,tags,id,license,comments,source,source-hostname,excerpt,filename,has_text
O/YINSazfJj8vhHna+P0mac8Y54=,"River, Clap Your Hands",Sheree Renée Thomas,uncannymagazine.com,2021-06-01,,,,,,https://www.uncannymagazine.com/article/river-clap-your-hands/,Uncanny Magazine,"Night All night long, the weary sound of water dripped from the roof into the bucket below, eroding her dreams. Ava woke from a sleep which bore her like an ocean, her mind still filled with the raindrop drum. The moon had veiled its face so that the stars could not see her cry. She […]",./scrape/jsonfiles/wuevcFFmBzSk5Ddr21HQ2RJdKbs.json,True
mmPfZpjEdWxb9tIAjMl5zz/b/4M=,Heart Shine,Shveta Thakrar,uncannymagazine.com,2021-06-01,,,,,,https://www.uncannymagazine.com/article/heart-shine/,Uncanny Magazine,"For Anna-Marie McLemore, a true lantern heart June in Buffalo was Komal’s favorite time, particularly early June after twilight. The gloaming, she’d read once, a fancy word for the mysterious time when day merged with night. That was when the fireflies came out. Late one such evening when she was thirteen, she sneaked downstairs, […]",./scrape/jsonfiles/92X08H4PyacGRfhiWjOXbPqoagE.json,True
12SPIqwKkeCU0tkF+hQ3Nl7EM2o=,Rooms Formed of Neurons and Sex,Ferrett Steinmetz,uncannymagazine.com,2016-10-04,,,,,,https://www.uncannymagazine.com/article/rooms-formed-neurons-sex/,Uncanny Magazine,"(Content Note: Some readers may find elements of this story disturbing.) The greatest tragedy of Lydia’s life was when she broke her boyfriend during sex. Admittedly, he was a brain in a jar, but she’d been trying to make do. Ross hadn’t always been a brain in a jar, but he’d been cerebrally canned long […]",./scrape/jsonfiles/-Bfx5+aIYTkM0TOd+jNO-OlWqj4.json,True
BrKF5/iAdfF6gJVmdRS9amXMDSY=,A Being Together Amongst Strangers,Arkady Martine,uncannymagazine.com,2020-05-05,,,,,,https://www.uncannymagazine.com/article/a-being-together-amongst-strangers/,Uncanny Magazine,"(Content note: descriptions of historical euthanasia, use of racial and misogynistic slurs.) The Miner’s Union got here first, in 1903, when they blasted the tunnel through the schist. They came from Colorado and Pennsylvania, from Ireland and Italy, Scotland and Canada; they came to work inside the mountain, one hundred eighty feet below sunlight. […]",./scrape/jsonfiles/JfBL99qUchHH5L222O5-P7x1TC8.json,True
HkjQP7zDMq2JClqWrVFzMpG0M08=,ask them who is doing the haunting (a vietnamese american underwater fairytale),T K Lê,uncannymagazine.com,2020-06-03,,,,,,https://www.uncannymagazine.com/article/ask-them-who-is-doing-the-haunting-a-vietnamese-american-underwater-fairytale/,Uncanny Magazine,,./scrape/jsonfiles/bKvSJCn34eOjbNURzPAEYkNIDL0.json,True
Uu3rNI2ne5nB1arYyuZ/UCWNfjg=,Old Habits,Nalo Hopkinson,uncannymagazine.com,2018-03-06,,,,,,https://www.uncannymagazine.com/article/old-habits/,Uncanny Magazine,"Ghost malls are even sadder than living people malls, even though malls of the living are already pretty damned sad places to be. And let me get this out of the way right now, before we go any farther; I’m dead, okay? I’m fucking dead. This is not going to be one of those stories […]",./scrape/jsonfiles/9fA4UPE-g68wk3oGjl4GAo0x6ew.json,True
9lIQB6CGoqLnvQ19ZHG8qt6etn8=,"If You Were a Tiger, I'd Have to Wear White - Uncanny",Maria Dahvana Headley,uncannymagazine.com,2014-11-04,,,,,,https://www.uncannymagazine.com/article/tiger-id-wear-white/,Uncanny Magazine,"If You Were a Tiger, I'd Have to Wear White. Short story by Maria Davhana Headley. Uncanny Magazine Issue One.",./scrape/jsonfiles/M64xn6l6nghEfjaHdM1ntB1YdHw.json,True
OdU/e8+Ge46l11ZByGCaQsuMIZQ=,The Coward Who Stole God’s Name,John Wiswell,uncannymagazine.com,2022-06-07,,,,,,https://www.uncannymagazine.com/article/the-coward-who-stole-gods-name/,Uncanny Magazine,"Who is the most beloved person alive? Is it one of those actors who plays superheroes? Is it a political leader? Maybe you’re a galaxy brain and say Beyoncé? No matter who you pick, you know you’re wrong. There’s always that better person who we love so unquestioningly that we forget they’re there. Sometimes, we […]",./scrape/jsonfiles/UoFeWEOzy2QmjyzeS+iga64rwec.json,True
m8KYKxjXgeYcgFb8Eq5jDjkrYC4=,And Never Mind the Watching Ones,Keffy R M Kehrli,uncannymagazine.com,2015-10-06,,,,,,https://www.uncannymagazine.com/article/and-never-mind-the-watching-ones/,Uncanny Magazine,And Never Mind the Watching Ones by Keffy R. M. Kehrli. Uncanny Magazine Issue Six short fiction,./scrape/jsonfiles/CjCbtDiBcasijhhi+nLfWLUUQYc.json,True
hhzHhqnJcuU28yd3aPs20EF3SPw=,The Witch of Orion Waste and the Boy Knight,E Lily Yu,uncannymagazine.com,2016-10-04,,,,,,https://www.uncannymagazine.com/article/witch-orion-waste-boy-knight/,Uncanny Magazine,"Once, on the edge of a stony scrub named for a star that fell burning from Orion a hundred years ago, there stood a hut with tin spangles strung from its rafters and ram bones mudded in its walls. Many witches had lived in the hut over the years, fair and foul, dark and light, […]",./scrape/jsonfiles/UoGaKZRM92uGj6qh7d6vLmOjztY.json,True
eM1DJnTjVrKoLFTDEs1rFzNwvsw=,"Nothing to Fear, Nothing to Fear",Senaa Ahmad,uncannymagazine.com,2019-01-01,,,,,,https://www.uncannymagazine.com/article/nothing-to-fear-nothing-to-fear/,Uncanny Magazine,"Huda will ask again and again. She will ask it on the first night at the summer place, the porch steps creaking like an old-timey pirate’s ship beneath their knees. She will ask it when they see the Amelia Earhart house way down the harbor, a curled finger, creepy, shuttered-off, and full of promise. She […]",./scrape/jsonfiles/+pJbfy36OQuSUqPYo7xmhYQt+AM.json,True
ux0jIgvbsksdHZc/pLRyI41LZtg=,Origins,Carlos Hernandez,uncannymagazine.com,2017-05-02,,,,,,https://www.uncannymagazine.com/article/origins/,Uncanny Magazine,"I am starving. Performing miracles for you—manifesting money from the air; deconstructing diseases; repairing broken bodies, imbalanced minds—costs me energy, and entropy nickel-and-dimes my soul day by day. So my hunger never leaves me, only grows. And there is no food for me here; I have foresworn eating anyone else. I am resigned to die. […]",./scrape/jsonfiles/qqCQsd1ZnFY2GZKoi8Ek+yb7BsQ.json,True
D6fpd1BtuCO/aIEP/GXu4gA6B+c=,For the Gardener’s Daughter,Alyssa Wong,uncannymagazine.com,2015-05-05,,,,,,https://www.uncannymagazine.com/article/gardeners-daughter/,Uncanny Magazine,"If I am Hades, my char’iot splintered When I met you; my cold bones ignited With heat, bright, that in my chest had wintered Through storms of cities, my own heart blighted. Your fingers’ warmth, your sighs, I’d sew them here— Imprinting flesh and bone with golden thread, So they might linger beyond half the […]",./scrape/jsonfiles/MmZ+tX+P35ADU+4aZX0z3ewHaAg.json,True
uCkpyKR47ARV/1lPhftwtKEv3Eo=,"Birth, Place",Brandon O’Brien,uncannymagazine.com,2017-09-05,,,,,,https://www.uncannymagazine.com/article/birth-place/,Uncanny Magazine,"I made this land myself. I put dirt in my own mouth and hoped it would mature; you made manure of the bodies of our mothers, asked us to chew the remains, and on our tongue they whispered, Babalú-Ayé, make my children potters of a planet, give them farmers’ […]",./scrape/jsonfiles/cxkKLOiipc+Z7+O1rSuHJrVbFpg.json,True
zSg03rjjjhvLd1OQjfbJHpHGTRI=,One Man's Treasure,Sarah Pinsker,uncannymagazine.com,2023-02-07,,,,,,https://www.uncannymagazine.com/article/one-mans-treasure/,Uncanny Magazine,"Aden had never once forgotten his gear for bulk trash day, but he found it touching that Nura still taped a monthly reminder note on the door from the kitchen to the garage. Sweet of her to remember, given how exhausted med school had her these days. He ducked out to the garage to toss […]",./scrape/jsonfiles/yuCLXe+YJ5ftyiYISTU7l45LLtE.json,True
5HAFP3kjM47+SzL2Q7MFrG5c9jQ=,Afternoon with Grandparents,Dominik Parisien,uncannymagazine.com,2017-12-05,,,,,,https://www.uncannymagazine.com/article/afternoon-with-grandparents/,Uncanny Magazine,"It felt like Communion, their slow dance in the kitchen. Somewhere a ghost-voiced radio played and the song was God promising forever, only watching them I knew it must be true.",./scrape/jsonfiles/lIm3jN1aqRDVEsxKK9DmeI-ZkPg.json,True
48pynDB+u2hzWLSRmyD87kwbJyw=,You Are Two Point Three Meters from Your Destination,Fran Wilde,uncannymagazine.com,2015-04-07,,,,,,https://www.uncannymagazine.com/article/you-are-two-point-three-meters-from-your-destination/,Uncanny Magazine,You Are Two Point Three Miles From Your Destination by Fran Wilde,./scrape/jsonfiles/DfAoKs7sg6-7uDL6E2KHSNAKOU0.json,True
nHIVqtbGF86YrbSop/vNtXodARE=,In That Place She Grows a Garden,Del Sandeen,uncannymagazine.com,2021-02-02,,,,,,https://www.uncannymagazine.com/article/in-that-place-she-grows-a-garden/,Uncanny Magazine,"All the students at Queen Mary Catholic High School knew about Principal Vargas’ death before the first bell. To Rayven James, it was welcome news. The entire student body swarmed through the hallways like a many-headed ocean, with straight brown, blond and black hair coloring the seas. An occasional pop of red floated past like […]",./scrape/jsonfiles/ouDss888UgdH1m93XBefVK6Ga2g.json,True
/k5G+R0FkVqCn0r0wSPWDwVpULU=,hypothesis for apocalypse,Khairani Barokka,uncannymagazine.com,2018-10-02,,,,,,https://www.uncannymagazine.com/article/hypothesis-for-apocalypse/,Uncanny Magazine,"elders told me your face could be opened like persimmon cleaving apart at the fingertips, reddened as blood does, as bloodied fingers will do. inside, a round sphere unheld by any other parts of any other. seed of nothing else will do, root and salve of you, sweet and cracked; surviving all droughts, i keep […]",./scrape/jsonfiles/EvijM224UagaQJxPw87Gd9kh9P4.json,True
/qWdfBnn95fXpgEISinRnluaHsY=,Nutrition Facts,D A Xiaolin Spires,uncannymagazine.com,2019-11-05,,,,,,https://www.uncannymagazine.com/article/nutrition-facts/,Uncanny Magazine,"I’m told that the recipe never changes. It’s the same taro congee day after day, no added powders or ingredients. The taste is supposed to be consistent with only a few shifts in nutrients. I palm the sensoring pad and the vending machine squeezes it out from the robot with the mixing bowl behind glass. […]",./scrape/jsonfiles/yl1w+vZBXwmfQffcCQFdsz3gpUM.json,True
0xrd5V+xIP3qdpFQnqxFdMqveuU=,The Chameleon's Gloves,Yoon Ha Lee,uncannymagazine.com,2021-08-03,,,,,,https://www.uncannymagazine.com/article/the-chameleons-gloves/,Uncanny Magazine,"Rhehan hated museums, but their partner Liyeusse had done unmentionable things to the ship’s stardrive the last time the two of them had fled the authorities, and the repairs had drained their savings. Which was why Rhehan was on a station too close to the more civilized regions of the dustways, flirting with a tall, […]",./scrape/jsonfiles/ESCKZoNEn-EiMYAjKWE9F214ELg.json,True
tKvL68O9b5N4RdhsLbfff6V7Ix0=,Crossing,Ewen Ma,uncannymagazine.com,2022-11-01,,,,,,https://www.uncannymagazine.com/article/crossing/,Uncanny Magazine,,./scrape/jsonfiles/FxqWB+eQaIxtVYPw-DLG3zQu1+A.json,True
uOWRynbVblfecs7o8NMPSIdIvxQ=,El Cantar of Rising Sun,Sabrina Vourvoulias,uncannymagazine.com,2016-07-05,,,,,,https://www.uncannymagazine.com/article/el-cantar-rising-sun/,Uncanny Magazine,"On the Avenue Count the houses of worship: From Tyson Street to Tabor in Olney, you can walk a straight avenue of redemption, rising with the sun. Baptist, Buddhist, Catholic, Episcopal, and Evangelical—every people to their house. Only I visit them all, as part of this mester de juglaría, this cycle of irregular meter and […]",./scrape/jsonfiles/CpnYVR91EQpjvkWKTywYl7QZhgs.json,True
9okJm0/HzQ0JXPRPmK7bnmLOWgI=,For All Those Who Sheltered Here,Del Sandeen,uncannymagazine.com,2021-12-07,,,,,,https://www.uncannymagazine.com/article/for-all-those-who-sheltered-here/,Uncanny Magazine,"(Content note: lynching violence) The first thing I remember was the heat of the sun on my tender skin, the curl of a single leaf opening. As I ate sunlight and drank rain, my limbs grew in number and size. See my trunk so thick and fine. See my leafy canopy. Those first few […]",./scrape/jsonfiles/JikLpnf1y324ROE8WRv-p9T2dx4.json,True
wjNSqmszdk3F5yIeZILx4zwboOI=,What to expect from the Hadron Collider as a college roommate,Betsy Aoki,uncannymagazine.com,2017-06-06,,,,,,https://www.uncannymagazine.com/article/expect-hadron-collider-college-roommate/,Uncanny Magazine,"It will probably not be home for supper anytime soon. Things will get broken and not put back together again. When you speak to it about paying its fair share of the rent, it will start at you with that far-away look, or as though it is squinting at things too small for you to […]",./scrape/jsonfiles/l5Gs5EMj97k9cOhPN-jggMGo1NQ.json,True
syXSA40tDIiBSSFbYhoaxbNBcZY=,Blessings,Naomi Novik,uncannymagazine.com,2018-05-01,,,,,,https://www.uncannymagazine.com/article/blessings/,Uncanny Magazine,"“Grace,” the drunk fairy said, “is by far the best of the blessings.” She was drunk because her hostess, who herself had been blessed with hospitality—and a reasonably wealthy husband—had spent the months before her first child’s birth in a fever of preparations, determined to obtain at least one blessing for her own offspring. She […]",./scrape/jsonfiles/+E6sY4kJMjdTF8rONtULaAgXiqU.json,True
tlW8+MX1py8a+z0psx97dgk4dZ0=,Cloudbending,Jennifer Crow,uncannymagazine.com,2015-04-07,,,,,,https://www.uncannymagazine.com/article/cloudbending/,Uncanny Magazine,Cloudbending by Jennifer Crow,./scrape/jsonfiles/yAAhD5Jn7J4NT+OME0pfR6yPo+8.json,True
fB09NqbDmzFyjGwnSDrzSqAfFe8=,"In Stock Images of the Future, Everything is White",Terese Mason Pierre,uncannymagazine.com,2022-05-03,,,,,,https://www.uncannymagazine.com/article/in-stock-images-of-the-future-everything-is-white/,Uncanny Magazine,"I don’t want flying cars. I want my language back. I want to glass-bottom boat my way to a dirt road with no street signs, squeeze myself on the grave of my restlessness, my atomic self-esteem. Five hundred years and we have finished. What have burned sugar and dyed cotton blighted? I […]",./scrape/jsonfiles/Ea1sumRQt37ikpJ7MUd1z7yIgHU.json,True
9/WS3qCAkgBS86T3L/7w6h7eD34=,Notes from Liminal Spaces,Hiromi Goto,uncannymagazine.com,2017-06-06,,,,,,https://www.uncannymagazine.com/article/notes-liminal-spaces/,Uncanny Magazine,"I am a first generation Japanese Canadian immigrant. I gratefully reside on the unceded traditional territories of the Coast Salish peoples: the Musqueam, the Skwxwú7mesh, and Tsleil Waututh Nations. It was an unusually warm night for mid-March and I had left the glass patio door open to let in the fresh air. I’d already heard […]",./scrape/jsonfiles/Fn1vR+6QeN9JUSrZpBW-8XrO41A.json,True
oCEXeWrVinIb/xhtkQ5Qh6cznbA=,You’ll Surely Drown Here If You Stay,Alyssa Wong,uncannymagazine.com,2016-06-07,,,,,,https://www.uncannymagazine.com/article/youll-surely-drown-stay/,Uncanny Magazine,"When the desert finally lets you go, naked and stumbling, your body humming with raw power and the song of dead things coiled under your tongue, you find Marisol waiting for you at the edge of the bluffs. She’s dressed in long sleeves and a skirt over her boots, her black hair tucked under a […]",./scrape/jsonfiles/BWEQZk2tKV0AMpoR9uvO93Ggc88.json,True
YPmoKW+LOPZ5Kj+kXhB7cSZNxLo=,"In Time, a Weed May Break Stone",Valerie Valdes,uncannymagazine.com,2023-04-04,,,,,,https://www.uncannymagazine.com/article/in-time-a-weed-may-break-stone/,Uncanny Magazine,"Nuria heard about the construct from one of the local farmer’s sons just before midday. She had finished her second cup of sweet coffee with milk and was slowly coaxing a sickle blade out of a hunk of metal when Tomau charged into her smithy, breathless, as if he’d run all the way from his […]",./scrape/jsonfiles/iKanWSMbSa1+V0AWi5n-KJRoMCg.json,True
Pg2q0kTyEhE/h4YvN4quOZHbBM8=,Ogres of East Africa,Sofia Samatar,uncannymagazine.com,2016-10-04,,,,,,https://www.uncannymagazine.com/article/ogres-east-africa/,Uncanny Magazine,"Catalogued by Alibhai M. Moosajee of Mombasa February 1907 1. Apul Apul A male ogre of the Great Lakes region. A melancholy character, he eats crickets to sweeten his voice. His house burned down with all of his children inside. His enemy is the Hare. [My informant, a woman of the highlands who calls herself […]",./scrape/jsonfiles/rjkAYQFN9qpcY5+t2LRIiVFDQDc.json,True
brfg8ASaIhB6wXxPGWK+NdTRZY4=,The Drowning Line,Haralambi Markov,uncannymagazine.com,2016-06-07,,,,,,https://www.uncannymagazine.com/article/the-drowning-line/,Uncanny Magazine,"To Anna–Maria, my roots, my strength It’s the satellite phone duct–taped around my left bicep that wakes me up. Not the late October noises in the deep night, nor the ice–cold water that cleaves my body in half at the abdomen. It’s the desperate ringing, muted under layers of plastic to keep it dry, and […]",./scrape/jsonfiles/E8GHXQosVOUlJgWe7Re9aYOXQ08.json,True
vULIi41JlcrFLmrR4hozPMX8Mhk=,Canst Thou Draw Out the Leviathan,Christopher Caldwell,uncannymagazine.com,2019-06-04,,,,,,https://www.uncannymagazine.com/article/canst-thou-draw-out-the-leviathan/,Uncanny Magazine,"(Content Note for use of racist slur.) John Wood boarded the Gracie-Ella ahead of the crew. He carried his sea chest on his shoulder. In a satchel slung low on his hip were his tools and the three things most precious to him: a lock of his grandmother’s hair, a shaving from the first cabinet […]",./scrape/jsonfiles/zKilsvuRPo9Lwnlm3pRirDpWZ4s.json,True
h4sEmAr4Sv1H1MePUMotwZdiRRo=,An Elder Resigns from the Chorus of Oedipus at Colonnus,Peter Tacy,uncannymagazine.com,2020-11-03,,,,,,https://www.uncannymagazine.com/article/an-elder-resigns-from-the-chorus-of-oedipus-at-colonnus/,Uncanny Magazine,"Not ever to be born surely was the better choice! By cruel fate we’re torn. We lack a voice in our dreadful ends; we forever know and forever show the gods aren’t friends to any living thing…! Yet, though washed by sea, we also can’t be free of the constant sting, the deepest, […]",./scrape/jsonfiles/HqDQAq+V1lqIY1iERUkVqten+Vw.json,True
QlSLwhw45giOrv478oYIVg6SxMY=,Future Saints,Terese Mason Pierre,uncannymagazine.com,2021-04-06,,,,,,https://www.uncannymagazine.com/article/future-saints/,Uncanny Magazine,"But who would pray to you, supply your canonization? First, all is muted, a green, speckled wash, and a balding man has just heard the worst news of his life, and your name comes to him as gently as a silver blanket placed on the face of a planetless child, the cry for help […]",./scrape/jsonfiles/8nix9Eg8z9zh17XbNRYRILj82cI.json,True
LiX76Dhhf5FJGp/tyGUf9ON1Kqo=,Big Box,Greg van Eekhout,uncannymagazine.com,2019-07-02,,,,,,https://www.uncannymagazine.com/article/big-box/,Uncanny Magazine,"I don’t know what I need, but I need a lot of it. And this is an opportunity. The store wasn’t here yesterday. There was a complex of car dealerships abutting one of those sprawling Phoenix strip malls where spray mist over the pathways so shoppers don’t get heatstroke. But now, somehow, inserted between the […]",./scrape/jsonfiles/V4Q6eAQ2mQSv7s7VLAcTrr6Gd3Y.json,True
ux6/25p573+al3osL5XfFGFzLT8=,A Letter from One Woman to Another,Cassandra Khaw,uncannymagazine.com,2019-01-01,,,,,,https://www.uncannymagazine.com/article/a-letter-from-one-woman-to-another/,Uncanny Magazine,"Keep him. That prince of yours with his hair souring to silver his sword gone to rust, the doormat king, paupered by fear. It is not a horse he rides but an ass, not a lordship he owns, but a home choked with dust, not love he proffers, but lies by the dozen, semen-thick and […]",./scrape/jsonfiles/XS8jm9BJKie2+adrpLw2I8Tucvg.json,True
r1zV6HRBPwn5HycuPlGxZ/Cbu/Q=,Apologies for breaking the glass slipper,Isabel Yap,uncannymagazine.com,2015-06-02,,,,,,https://www.uncannymagazine.com/article/apologies-for-breaking-the-glass-slipper/,Uncanny Magazine,"only it was really too inconvenient, you see, not least when it shattered on the staircase I was running up to catch the last train in that station without an escalator, salarymen swaying in front of me to a silent tune and nothing else but the surly stare of the konbini shopkeep, craning his head […]",./scrape/jsonfiles/XLBk+I+D83UJsRmNbMdaLmVShpE.json,True
+Zlwt+IFw6Cvr5DUXxRgU20xdUA=,Protestations Against the Idea of Anglicization,Cassandra Khaw,uncannymagazine.com,2017-03-07,,,,,,https://www.uncannymagazine.com/article/protestations-idea-anglicization/,Uncanny Magazine,"Anglicize this: my name is my fucking weapon. How’d you like that? My blade that cuts through the fat of your cultures, slicing out pieces so I can suck on the gobbets, grow strong on the things you’d kept for your personal comforts, grow sleek on your inadequacies because unlike you, we’ve never had it […]",./scrape/jsonfiles/1LdRO2g6WkU0eXnB-A0mbgZWcNw.json,True
xMEQGo9RJleeYgPXTrSkpziThuQ=,The Magician Speaks to the Fool,Ali Trotta,uncannymagazine.com,2019-06-04,,,,,,https://www.uncannymagazine.com/article/the-magician-speaks-to-the-fool/,Uncanny Magazine,"Someday, you will learn that life is mapped by misadventures and heartbreak, unruly as the sea, arranged and rearranged in waves, until everything is salt and sand. Someday, someone you marked as safe will call the witch out of your bones, and leave you full of burning, your mouth tasting like ash, the blessing of […]",./scrape/jsonfiles/5d6bT5VGLojO3Yr6F-eQTr7vyXg.json,True
LSaNc1qOke1yCYkv4j5Vl0CVd7A=,"The 207th Time I Went Back to March 9, 1980",Beth Cato,uncannymagazine.com,2022-09-06,,,,,,https://www.uncannymagazine.com/article/the-207th-time-i-went-back-to-march-9-1980/,Uncanny Magazine,"This is my 207th time returning to March 9, 1980, but the 35th time I have broken into my childhood home. Before I started using my homemade time machine, I had never been one to defy rules. Back at age seven, I stole a candy bar from a grocery store. Anvil-heavy guilt compelled me to […]",./scrape/jsonfiles/l9jrPCiCPxT2x01+J4c00tEiBYY.json,True
6HENVxMHrpPOY8mM0urrkN4WWMI=,Pockets,Amal El–Mohtar,uncannymagazine.com,2015-02-03,,,,,,https://www.uncannymagazine.com/article/pockets/,Uncanny Magazine,Pockets by Amal El-Mohtar. Uncanny Magazine Issue Two. Short fiction.,./scrape/jsonfiles/34U9Eiubc2qdwjUFZ6gr92lRd9Y.json,True
hiEHYAlQHwXAqOt/a6PYDe6wvgs=,"Don’t You Worry, You Aliens",Paul Cornell,uncannymagazine.com,2016-11-01,,,,,,https://www.uncannymagazine.com/article/dont-worry-aliens/,Uncanny Magazine,"There isn’t a virus. He’s pretty sure of that. The radio, when the BBC news had come back every day for a week, before ceasing once more, had mentioned rumours of a virus motivating some of the big “refugee trains” that had got stuck in the West Country. But nobody who’d left from round here […]",./scrape/jsonfiles/tae6zuqprx+LTOvWeouYTDcqHo4.json,True
p8peXhMXLV0E8QciIx0Ov7wjAjg=,Where Oaken Hearts Do Gather,Sarah Pinsker,uncannymagazine.com,2021-04-06,,,,,,https://www.uncannymagazine.com/article/where-oaken-hearts-do-gather/,Uncanny Magazine,"About “Where Oaken Hearts Do Gather” (5 contributors, 5 notes, 7 comments) →“Where Oaken Hearts Do Gather” (Roud 423, Child 313) is a traditional English folk ballad. Like many traditional songs, the lyrics are unattributed. Child transcribed twenty verses, and a twenty-first got added later (and is included here for some unknown reason—I keep […]",./scrape/jsonfiles/OspfkWTH8VBWSCOuk+RqFXi5QJU.json,True
gXfQOqOj3ujVtNW8nT7ZrEv/l2A=,Lest We Forget,Elizabeth Bear,uncannymagazine.com,2019-06-04,,,,,,https://www.uncannymagazine.com/article/lest-we-forget/,Uncanny Magazine,"I am dying of the war, though not in it. Such is the nature of wars. A person doesn’t have to die in battle to be killed by a war. A person doesn’t even have to be a soldier to die of one. Wars have always been slow killers as well as quick. The war […]",./scrape/jsonfiles/zMe0ekxtVebYNCof2tSshQGietQ.json,True
3kAdIWVbh1VrZ6xwspUTJiT19M4=,Henosis,N K Jemisin,uncannymagazine.com,2017-09-05,,,,,,https://www.uncannymagazine.com/article/henosis/,Uncanny Magazine,"Chapter 4 “But they’re going to kill you,” the woman said. Harkim sighed at her silhouette. “Of course they are,” he replied. Chapter 2 The car lurched again. Harkim looked up from his agent’s face on the backseat screen, wondering what on earth was wrong with his driver. “Luketon? Have you been at the […]",./scrape/jsonfiles/C1G0fGiZoUCSicca3JGwmOapkkY.json,True
WS6gN5jDtDsFDSmdtbJ8GHDydwY=,FIND A HOT ASIAN GIRLFRIEND NEAR YOU,Cynthia So,uncannymagazine.com,2018-08-07,,,,,,https://www.uncannymagazine.com/article/find-a-hot-asian-girlfriend-near-you/,Uncanny Magazine,"Gashapon girls, machine-made, capsule-kept; Sleeping beauties in bright baubles, Pristine toys oblivious to the world Before you. Crack the eggshell, watch me climb out. I was born knowing how to let you take me apart. You wanted something else but you got me. Close enough, right? Go somewhere else next time, put in a bit […]",./scrape/jsonfiles/neJ8gJ5DL1hFun1FKc0nliKu72k.json,True
8cW/bu3vnnM5h5CaaJrIL15LSiE=,"The Dead, In Their Uncontrollable Power",Karen Osborne,uncannymagazine.com,2019-03-05,,,,,,https://www.uncannymagazine.com/article/the-dead-in-their-uncontrollable-power/,Uncanny Magazine,"The funeral is nearly over when the dead captain explodes. Roses turn to shrapnel. The cathedral is lost in fire. I am drenched in blood. Bone buries itself in the wall next to my head, my arm, my howling, open mouth. I am standing at the back of the room where a sin-eater’s child belongs, […]",./scrape/jsonfiles/OqyyWy1wEq1cTAx02RrLXU7fRE4.json,True
